{
  "schema_version": "review_receipt.v1",
  "story_id": "S1",
  "head_commit": "1f984641871ee9994b80f75f608a9f336d0c24d2",
  "created_at": "2026-02-24T23:26:24Z",
  "review_basis": "STORY_SCOPE",
  "review_basis_cycle": 1,
  "tool": "devils-advocate",
  "prompt_style": "generic",
  "phase_equivalent": "R7",
  "citations": [],
  "finding_counts": {
    "P0": 0,
    "P1": 0,
    "P2": 0,
    "INFO": 0
  },
  "findings": []
}
