{
  "schema_version": "review_receipt.v1",
  "story_id": "S1",
  "head_commit": "1f984641871ee9994b80f75f608a9f336d0c24d2",
  "created_at": "2026-02-24T23:26:24Z",
  "review_basis": "STORY_SCOPE",
  "review_basis_cycle": 1,
  "tool": "pr-review",
  "prompt_style": "generic",
  "phase_equivalent": "R7",
  "citations": [],
  "finding_counts": {
    "P0": 0,
    "P1": 0,
    "P2": 3,
    "INFO": 0
  },
  "findings": [
    {
      "id": "PR-1",
      "priority": "P2",
      "classification": "Production wiring comment drift",
      "description": "`build_open_intent_with_assembly` still carries `TODO(slice-2): Wire as production entry point for order submission` while live open routing now uses `build_open_order_intent_runtime`; comment should be reworded or removed to prevent stale production-wiring assumptions."
    },
    {
      "id": "PR-3",
      "priority": "P2",
      "classification": "Stale test-call comments remain",
      "description": "`build_order_size` and `derive_instrument_kind` remain annotated as test-only despite now being exercised via `evaluate_assembled_pipeline`, which can mislead future reviewers on production coverage."
    },
    {
      "id": "PR-4",
      "priority": "P2",
      "classification": "Non-functional comment debt",
      "description": "`opens_blocked` in `crates/soldier_core/src/venue/cache.rs` still documents as test-only wiring, but is used by production base-gate and order-intent paths; stale comment lowers review signal quality."
    }
  ]
}
